{
  "$schema": "https://json-schema.org/draft/2020-12/schema",
  "$id": "https://organchor.org/schemas/directory-snapshot.v0.1.json",
  "type": "object",
  "required": ["type", "version", "snapshot_id", "generated_at", "directory_node", "trust_boundary", "records"],
  "properties": {
    "type": { "const": "OrgAnchorDirectorySnapshot" },
    "version": { "const": "0.1" },
    "snapshot_id": { "type": "string", "minLength": 1, "pattern": "^[A-Za-z0-9._:-]+$" },
    "generated_at": {
      "type": "string",
      "pattern": "^\\d{4}-\\d{2}-\\d{2}T\\d{2}:\\d{2}:\\d{2}(?:\\.\\d{3})?Z$"
    },
    "directory_node": {
      "type": "object",
      "required": ["name", "origin", "policy_url"],
      "properties": {
        "name": { "type": "string", "minLength": 1 },
        "origin": { "type": "string", "pattern": "^https?://.+" },
        "policy_url": { "type": "string", "pattern": "^https?://.+" }
      }
    },
    "trust_boundary": {
      "type": "object",
      "required": ["directory_is_trust_root", "final_trust_decision", "records_must_verify_at_origin"],
      "properties": {
        "directory_is_trust_root": { "const": false },
        "final_trust_decision": { "const": "EXTERNAL_AGENT" },
        "records_must_verify_at_origin": { "const": true }
      }
    },
    "records": {
      "type": "array",
      "items": {
        "type": "object",
        "required": [
          "type",
          "version",
          "record_id",
          "origin",
          "well_known_url",
          "verify_index_url",
          "organization",
          "discovery",
          "verification_summary",
          "evidence_summary",
          "source",
          "limitations"
        ],
        "properties": {
          "type": { "const": "OrgAnchorDirectoryRecord" },
          "version": { "const": "0.1" },
          "record_id": { "type": "string", "minLength": 1, "pattern": "^[A-Za-z0-9._:-]+$" },
          "origin": { "type": "string", "pattern": "^https?://.+" },
          "well_known_url": { "type": "string", "pattern": "^https?://.+" },
          "verify_index_url": { "type": "string", "pattern": "^https?://.+" },
          "organization": {
            "type": "object",
            "required": ["name", "display_name"],
            "properties": {
              "name": { "type": "string", "minLength": 1 },
              "display_name": { "type": "string", "minLength": 1 }
            }
          },
          "discovery": {
            "type": "object",
            "required": ["categories", "capabilities", "regions", "languages"],
            "properties": {
              "categories": { "$ref": "#/$defs/stringArray" },
              "capabilities": { "$ref": "#/$defs/stringArray" },
              "regions": { "$ref": "#/$defs/stringArray" },
              "languages": { "$ref": "#/$defs/stringArray" }
            }
          },
          "verification_summary": {
            "type": "object",
            "required": [
              "identity_status",
              "value_status",
              "policy_route",
              "root_authority_hash",
              "statement_hash",
              "last_verified_at"
            ],
            "properties": {
              "identity_status": { "enum": ["PASS", "FAIL", "NOT_VERIFIED"] },
              "value_status": { "enum": ["PASS", "WARN", "FAIL", "NOT_INCLUDED", "NOT_VERIFIED"] },
              "policy_route": {
                "enum": [
                  "STOP_IDENTITY_FAILURE",
                  "REVIEW_FAILED_CHECKS",
                  "REQUEST_VALUE_EVIDENCE",
                  "REVIEW_VALUE_WARNINGS",
                  "EXTERNAL_POLICY_REVIEW",
                  "READY_FOR_EXTERNAL_POLICY",
                  "REQUEST_ORIGIN_VERIFICATION"
                ]
              },
              "root_authority_hash": { "type": "string", "pattern": "^sha256:[0-9a-f]{64}$" },
              "statement_hash": { "type": "string", "pattern": "^sha256:[0-9a-f]{64}$" },
              "last_verified_at": {
                "type": "string",
                "pattern": "^\\d{4}-\\d{2}-\\d{2}T\\d{2}:\\d{2}:\\d{2}(?:\\.\\d{3})?Z$"
              }
            }
          },
          "evidence_summary": {
            "type": "object",
            "required": [
              "total_evidence_items",
              "third_party_claims",
              "reproducible_claims",
              "manual_checks",
              "unsupported_claims"
            ],
            "properties": {
              "total_evidence_items": { "type": "integer", "minimum": 0 },
              "third_party_claims": { "type": "integer", "minimum": 0 },
              "reproducible_claims": { "type": "integer", "minimum": 0 },
              "manual_checks": { "type": "integer", "minimum": 0 },
              "unsupported_claims": { "type": "integer", "minimum": 0 }
            }
          },
          "source": {
            "type": "object",
            "required": ["method", "added_at"],
            "properties": {
              "method": { "enum": ["manual", "crawler", "submitted", "imported"] },
              "added_at": {
                "type": "string",
                "pattern": "^\\d{4}-\\d{2}-\\d{2}T\\d{2}:\\d{2}:\\d{2}(?:\\.\\d{3})?Z$"
              }
            }
          },
          "limitations": { "$ref": "#/$defs/stringArray" }
        }
      }
    }
  },
  "$defs": {
    "stringArray": {
      "type": "array",
      "minItems": 1,
      "items": { "type": "string", "minLength": 1 }
    }
  }
}
